{
  "audit_event_id": "d1e2f3a4-b5c6-4d7e-8f90-a1b2c3d4e5f6",
  "event_type": "ENFORCEMENT_APPLIED",
  "sequence": 9,
  "context_id": "0e3c7a52-6f1b-4a7e-9d5c-2b8f4e1a9c30",
  "context_version": 3,
  "context_status": "REVOKED",
  "occurred_at": "2031-03-01T10:20:00.000000Z",
  "correlation_id": "corr_0123456789abcdef0123456789abcdef",
  "actor_kind": "SYSTEM",
  "data": {
    "reason": "CONTEXT_REVOKED",
    "attempt": 2,
    "result": {
      "status": "APPLIED",
      "terminated_calls": 1,
      "matched_calls": 1
    }
  },
  "enforcement_job_id": "4a2b3c4d-5e6f-4071-8283-94a5b6c7d8e9"
}
